<?xml version="1.0" encoding="UTF-8"?>
<!DOCTYPE SimpleWsdDoc SYSTEM "simple-wsd-doc.dtd">
<SimpleWsdDoc name="/written/spam/ucb26.txt">
  <word text="/" break_level="NO_BREAK"/>
  <word text="written" break_level="NO_BREAK"/>
  <word text="/" break_level="NO_BREAK"/>
  <word text="spam" lemma="spam" pos="NOUN" sense="/dictionary/sense/en_us_NOAD3e_2012/m_en_us1292742.002" break_level="NO_BREAK"/>
  <word text="/" break_level="NO_BREAK"/>
  <word text="ucb26.txt" break_level="NO_BREAK"/>
  <word text="To" break_level="PARAGRAPH_BREAK"/>
  <word text=":" break_level="NO_BREAK"/>
  <word text="Subject" lemma="subject" pos="NOUN" sense="/dictionary/sense/en_us_NOAD3e_2012/m_en_us1295267.001" break_level="LINE_BREAK"/>
  <word text=":" break_level="NO_BREAK"/>
  <word text="RE" break_level="SENTENCE_BREAK"/>
  <word text=":" break_level="NO_BREAK"/>
  <word text="Dear" lemma="dear" pos="ADJ" sense="/dictionary/sense/en_us_NOAD3e_2012/m_en_us1238652.001" break_level="SENTENCE_BREAK"/>
  <word text="xxx@xxx.xxx" break_level="SPACE_BREAK"/>
  <word text="83" break_level="SPACE_BREAK"/>
  <word text="%" break_level="NO_BREAK"/>
  <word text="0FF" break_level="SPACE_BREAK"/>
  <word text="From" break_level="LINE_BREAK"/>
  <word text=":" break_level="NO_BREAK"/>
  <word text="VIAGRA" break_level="SENTENCE_BREAK"/>
  <word text="Ã†" break_level="SPACE_BREAK"/>
  <word text="Official" break_level="SPACE_BREAK"/>
  <word text="Site" lemma="site" pos="NOUN" sense="/dictionary/sense/en_us_NOAD3e_2012/m_en_us1291008.004" break_level="SPACE_BREAK"/>
  <word text="Date" lemma="date" pos="NOUN" sense="/dictionary/sense/en_us_NOAD3e_2012/m_en_us1238437.001" break_level="LINE_BREAK"/>
  <word text=":" break_level="NO_BREAK"/>
  <word text="Tue" break_level="SENTENCE_BREAK"/>
  <word text="," break_level="NO_BREAK"/>
  <word text="1" break_level="SPACE_BREAK"/>
  <word text="Jul" break_level="SPACE_BREAK"/>
  <word text="2008" break_level="SPACE_BREAK"/>
  <word text="12:49:59" break_level="SPACE_BREAK"/>
  <word text="-0700" break_level="SPACE_BREAK"/>
  <word text="(" break_level="SPACE_BREAK"/>
  <word text="PDT" break_level="NO_BREAK"/>
  <word text=")" break_level="NO_BREAK"/>
  <word text="About" break_level="PARAGRAPH_BREAK"/>
  <word text="this" break_level="SPACE_BREAK"/>
  <word text="mailing" lemma="mailing" pos="NOUN" sense="/dictionary/sense/en_us_NOAD3e_2012/m_en_us1265401.001" break_level="SPACE_BREAK"/>
  <word text=":" break_level="NO_BREAK"/>
  <word text="You" break_level="PARAGRAPH_BREAK"/>
  <word text="are" lemma="be" pos="VERB" sense="/dictionary/sense/en_us_NOAD3e_2012/m_en_us1225404.014" break_level="SPACE_BREAK"/>
  <word text="receiving" lemma="receive" pos="VERB" sense="/dictionary/sense/en_us_NOAD3e_2012/m_en_us1283407.001" break_level="SPACE_BREAK"/>
  <word text="this" break_level="SPACE_BREAK"/>
  <word text="e-mail" break_level="SPACE_BREAK"/>
  <word text="because" break_level="SPACE_BREAK"/>
  <word text="you" break_level="SPACE_BREAK"/>
  <word text="subscribed" lemma="subscribe" pos="VERB" sense="/dictionary/sense/en_us_NOAD3e_2012/m_en_us1295349.001" break_level="SPACE_BREAK"/>
  <word text="to" break_level="SPACE_BREAK"/>
  <word text="MSN" break_level="SPACE_BREAK"/>
  <word text="Featured" break_level="SPACE_BREAK"/>
  <word text="Offers" break_level="SPACE_BREAK"/>
  <word text="." break_level="NO_BREAK"/>
  <word text="Microsoft" break_level="SENTENCE_BREAK"/>
  <word text="respects" break_level="SPACE_BREAK"/>
  <word text="your" break_level="SPACE_BREAK"/>
  <word text="privacy" break_level="SPACE_BREAK"/>
  <word text="." break_level="NO_BREAK"/>
  <word text="If" break_level="SENTENCE_BREAK"/>
  <word text="you" break_level="SPACE_BREAK"/>
  <word text="do" lemma="do" pos="VERB" sense="/dictionary/sense/en_us_NOAD3e_2012/m_en_us1241237.035" break_level="SPACE_BREAK"/>
  <word text="not" break_level="LINE_BREAK"/>
  <word text="wish" break_level="SPACE_BREAK"/>
  <word text="to" break_level="SPACE_BREAK"/>
  <word text="receive" lemma="receive" pos="VERB" sense="/dictionary/sense/en_us_NOAD3e_2012/m_en_us1283407.001" break_level="SPACE_BREAK"/>
  <word text="this" break_level="SPACE_BREAK"/>
  <word text="MSN" break_level="SPACE_BREAK"/>
  <word text="Featured" break_level="SPACE_BREAK"/>
  <word text="Offers" break_level="SPACE_BREAK"/>
  <word text="e-mail" break_level="SPACE_BREAK"/>
  <word text="," break_level="NO_BREAK"/>
  <word text="please" break_level="SPACE_BREAK"/>
  <word text="click" lemma="click" pos="VERB" sense="/dictionary/sense/en_us_NOAD3e_2012/m_en_us1233681.004" break_level="SPACE_BREAK"/>
  <word text="the" break_level="SPACE_BREAK"/>
  <word text="``" break_level="SPACE_BREAK"/>
  <word text="Unsubscribe" break_level="NO_BREAK"/>
  <word text="&#39;&#39;" break_level="NO_BREAK"/>
  <word text="link" lemma="link" pos="NOUN" sense="/dictionary/sense/en_us_NOAD3e_2012/m_en_us1263659.001" break_level="SPACE_BREAK"/>
  <word text="below" break_level="SPACE_BREAK"/>
  <word text="." break_level="NO_BREAK"/>
  <word text="This" break_level="SENTENCE_BREAK"/>
  <word text="will" break_level="SPACE_BREAK"/>
  <word text="not" break_level="SPACE_BREAK"/>
  <word text="unsubscribe" break_level="LINE_BREAK"/>
  <word text="you" break_level="SPACE_BREAK"/>
  <word text="from" break_level="SPACE_BREAK"/>
  <word text="e-mail" break_level="SPACE_BREAK"/>
  <word text="communications" lemma="communication" pos="NOUN" sense="/dictionary/sense/en_us_NOAD3e_2012/m_en_us1234839.001" break_level="SPACE_BREAK"/>
  <word text="from" break_level="SPACE_BREAK"/>
  <word text="third" break_level="SPACE_BREAK"/>
  <word text="-" break_level="NO_BREAK"/>
  <word text="party" break_level="NO_BREAK"/>
  <word text="advertisers" break_level="SPACE_BREAK"/>
  <word text="that" break_level="SPACE_BREAK"/>
  <word text="may" lemma="may" pos="VERB" sense="/dictionary/sense/en_us_NOAD3e_2012/m_en_us1266614.001" break_level="SPACE_BREAK"/>
  <word text="appear" lemma="appear" pos="VERB" sense="/dictionary/sense/en_us_NOAD3e_2012/m_en_us1222474.001" break_level="SPACE_BREAK"/>
  <word text="in" break_level="SPACE_BREAK"/>
  <word text="MSN" break_level="SPACE_BREAK"/>
  <word text="Feature" lemma="feature" pos="NOUN" sense="/dictionary/sense/en_us_NOAD3e_2012/m_en_us1246503.001" break_level="SPACE_BREAK"/>
  <word text="Offers" break_level="SPACE_BREAK"/>
  <word text="." break_level="NO_BREAK"/>
  <word text="This" break_level="SENTENCE_BREAK"/>
  <word text="shall" break_level="LINE_BREAK"/>
  <word text="not" break_level="SPACE_BREAK"/>
  <word text="constitute" lemma="constitute" pos="VERB" sense="/dictionary/sense/en_us_NOAD3e_2012/m_en_us1235534.001" break_level="SPACE_BREAK"/>
  <word text="an" break_level="SPACE_BREAK"/>
  <word text="offer" break_level="SPACE_BREAK"/>
  <word text="by" break_level="SPACE_BREAK"/>
  <word text="MSN" break_level="SPACE_BREAK"/>
  <word text="." break_level="NO_BREAK"/>
  <word text="MSN" break_level="SENTENCE_BREAK"/>
  <word text="shall" break_level="SPACE_BREAK"/>
  <word text="not" break_level="SPACE_BREAK"/>
  <word text="be" lemma="be" pos="VERB" sense="/dictionary/sense/en_us_NOAD3e_2012/m_en_us1225404.008" break_level="SPACE_BREAK"/>
  <word text="responsible" break_level="SPACE_BREAK"/>
  <word text="or" break_level="SPACE_BREAK"/>
  <word text="liable" lemma="liable" pos="ADJ" sense="/dictionary/sense/en_us_NOAD3e_2012/m_en_us1263232.001" break_level="SPACE_BREAK"/>
  <word text="for" break_level="SPACE_BREAK"/>
  <word text="the" break_level="SPACE_BREAK"/>
  <word text="advertisers" break_level="SPACE_BREAK"/>
  <word text="&#39;" break_level="NO_BREAK"/>
  <word text="content" lemma="content" pos="NOUN" sense="/dictionary/sense/en_us_NOAD3e_2012/m_en_us1235616.001" break_level="SPACE_BREAK"/>
  <word text="nor" break_level="SPACE_BREAK"/>
  <word text="any" break_level="SPACE_BREAK"/>
  <word text="of" break_level="SPACE_BREAK"/>
  <word text="the" break_level="SPACE_BREAK"/>
  <word text="goods" lemma="good" pos="NOUN" sense="/dictionary/sense/en_us_NOAD3e_2012/m_en_us1251501.027" break_level="LINE_BREAK"/>
  <word text="or" break_level="SPACE_BREAK"/>
  <word text="service" break_level="SPACE_BREAK"/>
  <word text="advertised" break_level="SPACE_BREAK"/>
  <word text="." break_level="NO_BREAK"/>
  <word text="Prices" lemma="price" pos="NOUN" sense="/dictionary/sense/en_us_NOAD3e_2012/m_en_us1280629.001" break_level="SENTENCE_BREAK"/>
  <word text="and" break_level="SPACE_BREAK"/>
  <word text="item" break_level="SPACE_BREAK"/>
  <word text="availability" break_level="SPACE_BREAK"/>
  <word text="subject" lemma="subject" pos="ADJ" sense="/dictionary/sense/en_us_NOAD3e_2012/m_en_us1295267.012" break_level="SPACE_BREAK"/>
  <word text="to" break_level="SPACE_BREAK"/>
  <word text="change" lemma="change" pos="VERB" sense="/dictionary/sense/en_us_NOAD3e_2012/m_en_us1232051.001" break_level="SPACE_BREAK"/>
  <word text="without" break_level="SPACE_BREAK"/>
  <word text="notice" lemma="notice" pos="NOUN" sense="/dictionary/sense/en_us_NOAD3e_2012/m_en_us1272186.002" break_level="SPACE_BREAK"/>
  <word text="." break_level="NO_BREAK"/>
  <word text="Microsoft" break_level="SENTENCE_BREAK"/>
  <word text="Corporation" break_level="SPACE_BREAK"/>
  <word text="," break_level="NO_BREAK"/>
  <word text="One" break_level="SPACE_BREAK"/>
  <word text="Microsoft" break_level="SPACE_BREAK"/>
  <word text="Way" break_level="SPACE_BREAK"/>
  <word text="," break_level="NO_BREAK"/>
  <word text="Redmond" break_level="SPACE_BREAK"/>
  <word text="," break_level="NO_BREAK"/>
  <word text="WA" break_level="SPACE_BREAK"/>
  <word text="98052" break_level="SPACE_BREAK"/>
</SimpleWsdDoc>
