<?xml version="1.0" encoding="UTF-8"?>
<!DOCTYPE SimpleWsdDoc SYSTEM "simple-wsd-doc.dtd">
<SimpleWsdDoc name="/written/newspaper:newswire/20000424_nyt-NEW.txt">
  <word text="/" break_level="NO_BREAK"/>
  <word text="written" break_level="NO_BREAK"/>
  <word text="/" break_level="NO_BREAK"/>
  <word text="newspaper" break_level="NO_BREAK"/>
  <word text=":" break_level="NO_BREAK"/>
  <word text="newswire" break_level="NO_BREAK"/>
  <word text="/" break_level="NO_BREAK"/>
  <word text="20000424" break_level="NO_BREAK"/>
  <word text="--" break_level="NO_BREAK"/>
  <word text="nyt" break_level="NO_BREAK"/>
  <word text="-" break_level="NO_BREAK"/>
  <word text="NEW.txt" break_level="NO_BREAK"/>
  <word text="IRAQ" break_level="PARAGRAPH_BREAK"/>
  <word text="-" break_level="NO_BREAK"/>
  <word text="POVERTY" break_level="NO_BREAK"/>
  <word text="(" break_level="SPACE_BREAK"/>
  <word text="Washington" break_level="NO_BREAK"/>
  <word text=")" break_level="NO_BREAK"/>
  <word text="Rep." break_level="PARAGRAPH_BREAK"/>
  <word text="Tony" break_level="SPACE_BREAK"/>
  <word text="Hall" break_level="SPACE_BREAK"/>
  <word text="," break_level="NO_BREAK"/>
  <word text="D" break_level="SPACE_BREAK"/>
  <word text="-" break_level="NO_BREAK"/>
  <word text="Ohio" break_level="NO_BREAK"/>
  <word text="," break_level="NO_BREAK"/>
  <word text="urges" break_level="SPACE_BREAK"/>
  <word text="the" break_level="SPACE_BREAK"/>
  <word text="United" break_level="SPACE_BREAK"/>
  <word text="Nations" break_level="SPACE_BREAK"/>
  <word text="to" break_level="SPACE_BREAK"/>
  <word text="allow" lemma="allow" pos="VERB" sense="/dictionary/sense/en_us_NOAD3e_2012/m_en_us1221081.001" break_level="SPACE_BREAK"/>
  <word text="a" break_level="SPACE_BREAK"/>
  <word text="freer" break_level="SPACE_BREAK"/>
  <word text="flow" lemma="flow" pos="NOUN" sense="/dictionary/sense/en_us_NOAD3e_2012/m_en_us1247899.013" break_level="SPACE_BREAK"/>
  <word text="of" break_level="PARAGRAPH_BREAK"/>
  <word text="food" break_level="SPACE_BREAK"/>
  <word text="and" break_level="SPACE_BREAK"/>
  <word text="medicine" lemma="medicine" pos="NOUN" sense="/dictionary/sense/en_us_NOAD3e_2012/m_en_us1266890.002" break_level="SPACE_BREAK"/>
  <word text="into" break_level="SPACE_BREAK"/>
  <word text="Iraq" break_level="SPACE_BREAK"/>
  <word text="." break_level="NO_BREAK"/>
  <word text="Hall" break_level="SENTENCE_BREAK"/>
  <word text="," break_level="NO_BREAK"/>
  <word text="who" break_level="SPACE_BREAK"/>
  <word text="recently" break_level="SPACE_BREAK"/>
  <word text="returned" lemma="return" pos="VERB" sense="/dictionary/sense/en_us_NOAD3e_2012/m_en_us1284725.001" break_level="SPACE_BREAK"/>
  <word text="from" break_level="SPACE_BREAK"/>
  <word text="a" break_level="SPACE_BREAK"/>
  <word text="trip" lemma="trip" pos="NOUN" sense="/dictionary/sense/en_us_NOAD3e_2012/m_en_us1300432.013" break_level="SPACE_BREAK"/>
  <word text="to" break_level="PARAGRAPH_BREAK"/>
  <word text="Iraq" break_level="SPACE_BREAK"/>
  <word text="," break_level="NO_BREAK"/>
  <word text="said" lemma="say" pos="VERB" sense="/dictionary/sense/en_us_NOAD3e_2012/m_en_us1287486.001" break_level="SPACE_BREAK"/>
  <word text="U.N." break_level="SPACE_BREAK"/>
  <word text="economic" lemma="economic" pos="ADJ" sense="/dictionary/sense/en_us_NOAD3e_2012/m_en_us1243053.001" break_level="SPACE_BREAK"/>
  <word text="sanctions" lemma="sanction" pos="NOUN" sense="/dictionary/sense/en_us_NOAD3e_2012/m_en_us1286968.001" break_level="SPACE_BREAK"/>
  <word text="have" break_level="SPACE_BREAK"/>
  <word text="hurt" break_level="SPACE_BREAK"/>
  <word text="millions" break_level="SPACE_BREAK"/>
  <word text="of" break_level="SPACE_BREAK"/>
  <word text="civilians" break_level="SPACE_BREAK"/>
  <word text="there" break_level="PARAGRAPH_BREAK"/>
  <word text="." break_level="NO_BREAK"/>
  <word text="By" break_level="PARAGRAPH_BREAK"/>
  <word text="AUSTIN" break_level="SPACE_BREAK"/>
  <word text="ZALKIN" break_level="SPACE_BREAK"/>
  <word text="." break_level="NO_BREAK"/>
</SimpleWsdDoc>
