<?xml version="1.0" encoding="UTF-8"?>
<!DOCTYPE SimpleWsdDoc SYSTEM "simple-wsd-doc.dtd">
<SimpleWsdDoc name="/written/spam/ucb28.txt">
  <word text="/" break_level="NO_BREAK"/>
  <word text="written" break_level="NO_BREAK"/>
  <word text="/" break_level="NO_BREAK"/>
  <word text="spam" lemma="spam" pos="NOUN" sense="/dictionary/sense/en_us_NOAD3e_2012/m_en_us1292742.002" break_level="NO_BREAK"/>
  <word text="/" break_level="NO_BREAK"/>
  <word text="ucb28.txt" break_level="NO_BREAK"/>
  <word text="From" break_level="PARAGRAPH_BREAK"/>
  <word text=":" break_level="NO_BREAK"/>
  <word text="``" break_level="SPACE_BREAK"/>
  <word text="jeremiah" break_level="NO_BREAK"/>
  <word text="huntington" break_level="SPACE_BREAK"/>
  <word text="&#39;&#39;" break_level="NO_BREAK"/>
  <word text="To" break_level="LINE_BREAK"/>
  <word text=":" break_level="NO_BREAK"/>
  <word text="Subject" lemma="subject" pos="NOUN" sense="/dictionary/sense/en_us_NOAD3e_2012/m_en_us1295267.001" break_level="LINE_BREAK"/>
  <word text=":" break_level="NO_BREAK"/>
  <word text="ID" lemma="ID" pos="NOUN" sense="/dictionary/sense/en_us_NOAD3e_2012/m_en_us1256893.003" break_level="SENTENCE_BREAK"/>
  <word text=":" break_level="NO_BREAK"/>
  <word text="52627" break_level="NO_BREAK"/>
  <word text="Like" break_level="SPACE_BREAK"/>
  <word text="our" break_level="SPACE_BREAK"/>
  <word text="watches" lemma="watch" pos="NOUN" sense="/dictionary/sense/en_us_NOAD3e_2012/m_en_us1305222.010" break_level="SPACE_BREAK"/>
  <word text="," break_level="NO_BREAK"/>
  <word text="love" break_level="SPACE_BREAK"/>
  <word text="our" break_level="SPACE_BREAK"/>
  <word text="prices" lemma="price" pos="NOUN" sense="/dictionary/sense/en_us_NOAD3e_2012/m_en_us1280629.001" break_level="SPACE_BREAK"/>
  <word text="Date" lemma="date" pos="NOUN" sense="/dictionary/sense/en_us_NOAD3e_2012/m_en_us1238437.001" break_level="LINE_BREAK"/>
  <word text=":" break_level="NO_BREAK"/>
  <word text="Wed" break_level="SENTENCE_BREAK"/>
  <word text="," break_level="NO_BREAK"/>
  <word text="02" break_level="SPACE_BREAK"/>
  <word text="Jul" break_level="SPACE_BREAK"/>
  <word text="2008" break_level="SPACE_BREAK"/>
  <word text="09:51:41" break_level="SPACE_BREAK"/>
  <word text="+0000" break_level="SPACE_BREAK"/>
  <word text="Speed" lemma="speed" pos="VERB" sense="/dictionary/sense/en_us_NOAD3e_2012/m_en_us1292982.010" break_level="PARAGRAPH_BREAK"/>
  <word text="up" break_level="SPACE_BREAK"/>
  <word text="to" break_level="SPACE_BREAK"/>
  <word text="the" break_level="SPACE_BREAK"/>
  <word text="nightclub" break_level="SPACE_BREAK"/>
  <word text="with" break_level="SPACE_BREAK"/>
  <word text="a" break_level="SPACE_BREAK"/>
  <word text="diamond" lemma="diamond" pos="NOUN" sense="/dictionary/sense/en_us_NOAD3e_2012/m_en_us1240094.001" break_level="SPACE_BREAK"/>
  <word text="studded" break_level="SPACE_BREAK"/>
  <word text="luxury" break_level="SPACE_BREAK"/>
  <word text="watch" lemma="watch" pos="NOUN" sense="/dictionary/sense/en_us_NOAD3e_2012/m_en_us1305222.010" break_level="SPACE_BREAK"/>
  <word text="strapped" lemma="strap" pos="VERB" sense="/dictionary/sense/en_us_NOAD3e_2012/m_en_us1294827.005" break_level="SPACE_BREAK"/>
  <word text="around" break_level="SPACE_BREAK"/>
  <word text="your" break_level="SPACE_BREAK"/>
  <word text="wrist" lemma="wrist" pos="NOUN" sense="/dictionary/sense/en_us_NOAD3e_2012/m_en_us1307263.001" break_level="SPACE_BREAK"/>
  <word text="," break_level="NO_BREAK"/>
  <word text="and" break_level="SPACE_BREAK"/>
  <word text="watch" lemma="watch" pos="VERB" sense="/dictionary/sense/en_us_NOAD3e_2012/m_en_us1305222.001" break_level="SPACE_BREAK"/>
  <word text="everybody" break_level="SPACE_BREAK"/>
  <word text="stare" break_level="SPACE_BREAK"/>
  <word text="in" break_level="SPACE_BREAK"/>
  <word text="awe" break_level="SPACE_BREAK"/>
  <word text="." break_level="NO_BREAK"/>
  <word text="Business" break_level="SENTENCE_BREAK"/>
  <word text="colleagues" break_level="SPACE_BREAK"/>
  <word text="will" lemma="will" pos="VERB" sense="/dictionary/sense/en_us_NOAD3e_2012/m_en_us1306429.001" break_level="SPACE_BREAK"/>
  <word text="envy" break_level="SPACE_BREAK"/>
  <word text="your" break_level="SPACE_BREAK"/>
  <word text="wealth" break_level="SPACE_BREAK"/>
  <word text=";" break_level="NO_BREAK"/>
  <word text="with" break_level="SPACE_BREAK"/>
  <word text="$" break_level="SPACE_BREAK"/>
  <word text="20,000" break_level="NO_BREAK"/>
  <word text="around" break_level="SPACE_BREAK"/>
  <word text="your" break_level="SPACE_BREAK"/>
  <word text="wrist" lemma="wrist" pos="NOUN" sense="/dictionary/sense/en_us_NOAD3e_2012/m_en_us1307263.001" break_level="SPACE_BREAK"/>
  <word text="," break_level="NO_BREAK"/>
  <word text="success" break_level="SPACE_BREAK"/>
  <word text="and" break_level="SPACE_BREAK"/>
  <word text="a" break_level="SPACE_BREAK"/>
  <word text="statement" break_level="SPACE_BREAK"/>
  <word text="is" lemma="be" pos="VERB" sense="/dictionary/sense/en_us_NOAD3e_2012/m_en_us1225404.008" break_level="SPACE_BREAK"/>
  <word text="assured" break_level="SPACE_BREAK"/>
  <word text="." break_level="NO_BREAK"/>
  <word text="With" break_level="SENTENCE_BREAK"/>
  <word text="famous" break_level="SPACE_BREAK"/>
  <word text="luxury" break_level="SPACE_BREAK"/>
  <word text="brands" lemma="brand" pos="NOUN" sense="/dictionary/sense/en_us_NOAD3e_2012/m_en_us1228470.001" break_level="SPACE_BREAK"/>
  <word text="to" break_level="SPACE_BREAK"/>
  <word text="choose" break_level="SPACE_BREAK"/>
  <word text="from" break_level="SPACE_BREAK"/>
  <word text=":" break_level="NO_BREAK"/>
  <word text="Rolex" break_level="SENTENCE_BREAK"/>
  <word text="Patek" break_level="LINE_BREAK"/>
  <word text="Cartier" break_level="LINE_BREAK"/>
  <word text="Breitling" break_level="LINE_BREAK"/>
  <word text="Bell" break_level="LINE_BREAK"/>
  <word text="&amp;" break_level="SPACE_BREAK"/>
  <word text="Ross" break_level="SPACE_BREAK"/>
  <word text="and" break_level="LINE_BREAK"/>
  <word text="more" break_level="SPACE_BREAK"/>
  <word text="than" break_level="SPACE_BREAK"/>
  <word text="two" break_level="SPACE_BREAK"/>
  <word text="dozen" lemma="dozen" pos="NOUN" sense="/dictionary/sense/en_us_NOAD3e_2012/m_en_us1241892.001" break_level="SPACE_BREAK"/>
  <word text="other" lemma="other" pos="ADJ" sense="/dictionary/sense/en_us_NOAD3e_2012/m_en_us1274198.001" break_level="SPACE_BREAK"/>
  <word text="designer" break_level="SPACE_BREAK"/>
  <word text="brands" lemma="brand" pos="NOUN" sense="/dictionary/sense/en_us_NOAD3e_2012/m_en_us1228470.001" break_level="SPACE_BREAK"/>
  <word text="-" break_level="SPACE_BREAK"/>
  <word text="what" break_level="SPACE_BREAK"/>
  <word text="are" break_level="SPACE_BREAK"/>
  <word text="you" break_level="SPACE_BREAK"/>
  <word text="waiting" lemma="wait" pos="VERB" sense="/dictionary/sense/en_us_NOAD3e_2012/m_en_us1304874.001" break_level="SPACE_BREAK"/>
  <word text="for" break_level="SPACE_BREAK"/>
  <word text="?" break_level="NO_BREAK"/>
  <word text="Pay" lemma="pay" pos="VERB" sense="/dictionary/sense/en_us_NOAD3e_2012/m_en_us1276209.001" break_level="SENTENCE_BREAK"/>
  <word text="only" lemma="only" pos="ADV" sense="/dictionary/sense/en_us_NOAD3e_2012/m_en_us1273443.001" break_level="SPACE_BREAK"/>
  <word text="$" break_level="SPACE_BREAK"/>
  <word text="99" break_level="NO_BREAK"/>
  <word text="for" break_level="SPACE_BREAK"/>
  <word text="watches" lemma="watch" pos="NOUN" sense="/dictionary/sense/en_us_NOAD3e_2012/m_en_us1305222.010" break_level="SPACE_BREAK"/>
  <word text="that" break_level="SPACE_BREAK"/>
  <word text="are" lemma="be" pos="VERB" sense="/dictionary/sense/en_us_NOAD3e_2012/m_en_us1225404.008" break_level="SPACE_BREAK"/>
  <word text="worth" break_level="SPACE_BREAK"/>
  <word text="thousands" break_level="SPACE_BREAK"/>
  <word text="and" break_level="SPACE_BREAK"/>
  <word text="thousands" break_level="SPACE_BREAK"/>
  <word text="." break_level="NO_BREAK"/>
  <word text="Shop" lemma="shop" pos="VERB" sense="/dictionary/sense/en_us_NOAD3e_2012/m_en_us1290155.007" break_level="SENTENCE_BREAK"/>
  <word text="safely" break_level="SPACE_BREAK"/>
  <word text="and" break_level="SPACE_BREAK"/>
  <word text="securely" break_level="SPACE_BREAK"/>
  <word text="online" break_level="SPACE_BREAK"/>
  <word text="in" break_level="SPACE_BREAK"/>
  <word text="2008" break_level="SPACE_BREAK"/>
  <word text="." break_level="NO_BREAK"/>
  <word text="-" break_level="SENTENCE_BREAK"/>
  <word text="Visit" lemma="visit" pos="VERB" sense="/dictionary/sense/en_us_NOAD3e_2012/m_en_us1304446.001" break_level="SPACE_BREAK"/>
  <word text="our" break_level="SPACE_BREAK"/>
  <word text="site" lemma="site" pos="NOUN" sense="/dictionary/sense/en_us_NOAD3e_2012/m_en_us1291008.004" break_level="SPACE_BREAK"/>
  <word text="-" break_level="SPACE_BREAK"/>
  <word text="www.mibnne.com" break_level="SPACE_BREAK"/>
</SimpleWsdDoc>
