<?xml version="1.0" encoding="UTF-8"?>
<!DOCTYPE SimpleWsdDoc SYSTEM "simple-wsd-doc.dtd">
<SimpleWsdDoc name="/written/spam/ucb54.txt">
  <word text="/" break_level="NO_BREAK"/>
  <word text="written" break_level="NO_BREAK"/>
  <word text="/" break_level="NO_BREAK"/>
  <word text="spam" lemma="spam" pos="NOUN" sense="/dictionary/sense/en_us_NOAD3e_2012/m_en_us1292742.002" break_level="NO_BREAK"/>
  <word text="/" break_level="NO_BREAK"/>
  <word text="ucb54.txt" break_level="NO_BREAK"/>
  <word text="From" break_level="PARAGRAPH_BREAK"/>
  <word text=":" break_level="NO_BREAK"/>
  <word text="Good" lemma="good" pos="ADJ" sense="/dictionary/sense/en_us_NOAD3e_2012/m_en_us1251501.001" break_level="SENTENCE_BREAK"/>
  <word text="Erection" lemma="erection" pos="NOUN" sense="/dictionary/sense/en_us_NOAD3e_2012/m_en_us1244701.003" break_level="SPACE_BREAK"/>
  <word text="To" break_level="LINE_BREAK"/>
  <word text=":" break_level="NO_BREAK"/>
  <word text="xxx@xxx.xxx" break_level="SPACE_BREAK"/>
  <word text="Subject" lemma="subject" pos="NOUN" sense="/dictionary/sense/en_us_NOAD3e_2012/m_en_us1295267.001" break_level="LINE_BREAK"/>
  <word text=":" break_level="NO_BREAK"/>
  <word text="The" break_level="SENTENCE_BREAK"/>
  <word text="problem" lemma="problem" pos="NOUN" sense="/dictionary/sense/en_us_NOAD3e_2012/m_en_us1280894.001" break_level="SPACE_BREAK"/>
  <word text="has" lemma="have" pos="VERB" sense="/dictionary/sense/en_us_NOAD3e_2012/m_en_us1253820.001" break_level="SPACE_BREAK"/>
  <word text="gone" lemma="go" pos="VERB" sense="/dictionary/sense/en_us_NOAD3e_2012/m_en_us1251252.015" break_level="SPACE_BREAK"/>
  <word text="with" break_level="SPACE_BREAK"/>
  <word text="VIAGRA" break_level="SPACE_BREAK"/>
  <word text="!" break_level="NO_BREAK"/>
  <word text="Date" lemma="date" pos="NOUN" sense="/dictionary/sense/en_us_NOAD3e_2012/m_en_us1238437.001" break_level="SENTENCE_BREAK"/>
  <word text=":" break_level="NO_BREAK"/>
  <word text="Wed" break_level="SENTENCE_BREAK"/>
  <word text="," break_level="NO_BREAK"/>
  <word text="26" break_level="SPACE_BREAK"/>
  <word text="Sep" break_level="SPACE_BREAK"/>
  <word text="2007" break_level="SPACE_BREAK"/>
  <word text="14:22:20" break_level="SPACE_BREAK"/>
  <word text="-0000" break_level="SPACE_BREAK"/>
  <word text="What" break_level="PARAGRAPH_BREAK"/>
  <word text="is" lemma="be" pos="VERB" sense="/dictionary/sense/en_us_NOAD3e_2012/m_en_us1225404.008" break_level="SPACE_BREAK"/>
  <word text="Erectile" break_level="SPACE_BREAK"/>
  <word text="Dysfunction" break_level="SPACE_BREAK"/>
  <word text="(" break_level="SPACE_BREAK"/>
  <word text="ED" break_level="NO_BREAK"/>
  <word text=")" break_level="NO_BREAK"/>
  <word text="?" break_level="NO_BREAK"/>
  <word text="Erectile" break_level="SENTENCE_BREAK"/>
  <word text="dysfunction" break_level="SPACE_BREAK"/>
  <word text="," break_level="NO_BREAK"/>
  <word text="sometimes" break_level="SPACE_BREAK"/>
  <word text="referred" lemma="refer" pos="VERB" sense="/dictionary/sense/en_us_NOAD3e_2012/m_en_us1283794.001" break_level="SPACE_BREAK"/>
  <word text="to" break_level="LINE_BREAK"/>
  <word text="as" break_level="SPACE_BREAK"/>
  <word text="impotence" break_level="SPACE_BREAK"/>
  <word text="," break_level="NO_BREAK"/>
  <word text="is" lemma="be" pos="VERB" sense="/dictionary/sense/en_us_NOAD3e_2012/m_en_us1225404.008" break_level="SPACE_BREAK"/>
  <word text="the" break_level="SPACE_BREAK"/>
  <word text="inability" break_level="SPACE_BREAK"/>
  <word text="for" break_level="SPACE_BREAK"/>
  <word text="a" break_level="SPACE_BREAK"/>
  <word text="sexually" break_level="SPACE_BREAK"/>
  <word text="active" lemma="active" pos="ADJ" sense="/dictionary/sense/en_us_NOAD3e_2012/m_en_us1219797.005" break_level="SPACE_BREAK"/>
  <word text="male" break_level="SPACE_BREAK"/>
  <word text="to" break_level="SPACE_BREAK"/>
  <word text="obtain" lemma="obtain" pos="VERB" sense="/dictionary/sense/en_us_NOAD3e_2012/m_en_us1272728.001" break_level="SPACE_BREAK"/>
  <word text="and" break_level="LINE_BREAK"/>
  <word text="sustain" lemma="sustain" pos="VERB" sense="/dictionary/sense/en_us_NOAD3e_2012/m_en_us1296104.001" break_level="SPACE_BREAK"/>
  <word text="an" break_level="SPACE_BREAK"/>
  <word text="erection" lemma="erection" pos="NOUN" sense="/dictionary/sense/en_us_NOAD3e_2012/m_en_us1244701.003" break_level="SPACE_BREAK"/>
  <word text="for" break_level="SPACE_BREAK"/>
  <word text="sexual" lemma="sexual" pos="ADJ" sense="/dictionary/sense/en_us_NOAD3e_2012/m_en_us1289518.001" break_level="SPACE_BREAK"/>
  <word text="purposes" break_level="SPACE_BREAK"/>
  <word text="." break_level="NO_BREAK"/>
  <word text="In" break_level="SENTENCE_BREAK"/>
  <word text="the" break_level="SPACE_BREAK"/>
  <word text="past" lemma="past" pos="NOUN" sense="/dictionary/sense/en_us_NOAD3e_2012/m_en_us1275970.005" break_level="SPACE_BREAK"/>
  <word text="," break_level="NO_BREAK"/>
  <word text="this" break_level="SPACE_BREAK"/>
  <word text="has" lemma="have" pos="VERB" sense="/dictionary/sense/en_us_NOAD3e_2012/m_en_us1253820.034" break_level="SPACE_BREAK"/>
  <word text="been" break_level="SPACE_BREAK"/>
  <word text="very" break_level="LINE_BREAK"/>
  <word text="embarrassing" break_level="SPACE_BREAK"/>
  <word text="for" break_level="SPACE_BREAK"/>
  <word text="men" lemma="man" pos="NOUN" sense="/dictionary/sense/en_us_NOAD3e_2012/m_en_us1265688.001" break_level="SPACE_BREAK"/>
  <word text="," break_level="NO_BREAK"/>
  <word text="and" break_level="SPACE_BREAK"/>
  <word text="a" break_level="SPACE_BREAK"/>
  <word text="source" break_level="SPACE_BREAK"/>
  <word text="of" break_level="SPACE_BREAK"/>
  <word text="anxiety" break_level="SPACE_BREAK"/>
  <word text="for" break_level="SPACE_BREAK"/>
  <word text="their" break_level="SPACE_BREAK"/>
  <word text="partners" lemma="partner" pos="NOUN" sense="/dictionary/sense/en_us_NOAD3e_2012/m_en_us1275836.001" break_level="SPACE_BREAK"/>
  <word text="," break_level="NO_BREAK"/>
  <word text="and" break_level="LINE_BREAK"/>
  <word text="," break_level="NO_BREAK"/>
  <word text="in" break_level="SPACE_BREAK"/>
  <word text="fact" break_level="SPACE_BREAK"/>
  <word text="," break_level="NO_BREAK"/>
  <word text="there" break_level="SPACE_BREAK"/>
  <word text="has" lemma="have" pos="VERB" sense="/dictionary/sense/en_us_NOAD3e_2012/m_en_us1253820.034" break_level="SPACE_BREAK"/>
  <word text="been" break_level="SPACE_BREAK"/>
  <word text="very" break_level="SPACE_BREAK"/>
  <word text="little" break_level="SPACE_BREAK"/>
  <word text="diagnostic" lemma="diagnostic" pos="ADJ" sense="/dictionary/sense/en_us_NOAD3e_2012/m_en_us1240059.001" break_level="SPACE_BREAK"/>
  <word text="testing" lemma="test" pos="NOUN" sense="/dictionary/sense/en_us_NOAD3e_2012/m_en_us1297943.001" break_level="SPACE_BREAK"/>
  <word text="or" break_level="SPACE_BREAK"/>
  <word text="treatments" break_level="SPACE_BREAK"/>
  <word text="available" break_level="LINE_BREAK"/>
  <word text="up" break_level="SPACE_BREAK"/>
  <word text="until" break_level="SPACE_BREAK"/>
  <word text="very" break_level="SPACE_BREAK"/>
  <word text="recently.But" break_level="SPACE_BREAK"/>
  <word text="now" lemma="now" pos="ADV" sense="/dictionary/sense/en_us_NOAD3e_2012/m_en_us1272258.001" break_level="SPACE_BREAK"/>
  <word text="the" break_level="SPACE_BREAK"/>
  <word text="problem" lemma="problem" pos="NOUN" sense="/dictionary/sense/en_us_NOAD3e_2012/m_en_us1280894.001" break_level="SPACE_BREAK"/>
  <word text="has" lemma="have" pos="VERB" sense="/dictionary/sense/en_us_NOAD3e_2012/m_en_us1253820.001" break_level="SPACE_BREAK"/>
  <word text="gone" lemma="go" pos="VERB" sense="/dictionary/sense/en_us_NOAD3e_2012/m_en_us1251252.015" break_level="SPACE_BREAK"/>
  <word text="with" break_level="SPACE_BREAK"/>
  <word text="VIAGRA" break_level="SPACE_BREAK"/>
  <word text="!" break_level="NO_BREAK"/>
  <word text="Buy" lemma="buy" pos="VERB" sense="/dictionary/sense/en_us_NOAD3e_2012/m_en_us1229786.001" break_level="SENTENCE_BREAK"/>
  <word text="VIAGRA" break_level="SPACE_BREAK"/>
  <word text="at" break_level="SPACE_BREAK"/>
  <word text="our" break_level="SPACE_BREAK"/>
  <word text="online" break_level="SPACE_BREAK"/>
  <word text="store" lemma="store" pos="NOUN" sense="/dictionary/sense/en_us_NOAD3e_2012/m_en_us1294689.001" break_level="SPACE_BREAK"/>
  <word text="!" break_level="NO_BREAK"/>
</SimpleWsdDoc>
