<?xml version="1.0" encoding="UTF-8"?>
<!DOCTYPE SimpleWsdDoc SYSTEM "simple-wsd-doc.dtd">
<SimpleWsdDoc name="/written/email/lists-003-2144868.txt">
  <word text="/" break_level="NO_BREAK"/>
  <word text="written" break_level="NO_BREAK"/>
  <word text="/" break_level="NO_BREAK"/>
  <word text="email" break_level="NO_BREAK"/>
  <word text="/" break_level="NO_BREAK"/>
  <word text="lists" lemma="list" pos="NOUN" sense="/dictionary/sense/en_us_NOAD3e_2012/m_en_us1263771.001" break_level="NO_BREAK"/>
  <word text="-" break_level="NO_BREAK"/>
  <word text="003" break_level="NO_BREAK"/>
  <word text="-" break_level="NO_BREAK"/>
  <word text="2144868.txt" break_level="NO_BREAK"/>
  <word text="docno" break_level="PARAGRAPH_BREAK"/>
  <word text="=" break_level="NO_BREAK"/>
  <word text="``" break_level="NO_BREAK"/>
  <word text="lists" break_level="NO_BREAK"/>
  <word text="-" break_level="NO_BREAK"/>
  <word text="003" break_level="NO_BREAK"/>
  <word text="-" break_level="NO_BREAK"/>
  <word text="2144868" break_level="NO_BREAK"/>
  <word text="&#39;&#39;" break_level="NO_BREAK"/>
  <word text="received" lemma="receive" pos="VERB" sense="/dictionary/sense/en_us_NOAD3e_2012/m_en_us1283407.001" break_level="LINE_BREAK"/>
  <word text="=" break_level="NO_BREAK"/>
  <word text="``" break_level="NO_BREAK"/>
  <word text="Tue" break_level="NO_BREAK"/>
  <word text="May" break_level="SPACE_BREAK"/>
  <word text="18" break_level="SPACE_BREAK"/>
  <word text="20:20:31" break_level="SPACE_BREAK"/>
  <word text="1993" break_level="SPACE_BREAK"/>
  <word text="EST" break_level="SPACE_BREAK"/>
  <word text="&#39;&#39;" break_level="NO_BREAK"/>
  <word text="sent" lemma="send" pos="VERB" sense="/dictionary/sense/en_us_NOAD3e_2012/m_en_us1289024.001" break_level="LINE_BREAK"/>
  <word text="=" break_level="NO_BREAK"/>
  <word text="``" break_level="NO_BREAK"/>
  <word text="Wed" break_level="NO_BREAK"/>
  <word text="," break_level="NO_BREAK"/>
  <word text="19" break_level="SPACE_BREAK"/>
  <word text="May" break_level="SPACE_BREAK"/>
  <word text="1993" break_level="SPACE_BREAK"/>
  <word text="12:17:09" break_level="SPACE_BREAK"/>
  <word text="+0900" break_level="SPACE_BREAK"/>
  <word text="(" break_level="SPACE_BREAK"/>
  <word text="JST" break_level="NO_BREAK"/>
  <word text=")" break_level="NO_BREAK"/>
  <word text="&#39;&#39;" break_level="NO_BREAK"/>
  <word text="name" lemma="name" pos="NOUN" sense="/dictionary/sense/en_us_NOAD3e_2012/m_en_us1270390.001" break_level="LINE_BREAK"/>
  <word text="=" break_level="NO_BREAK"/>
  <word text="``" break_level="NO_BREAK"/>
  <word text="Masataka" break_level="NO_BREAK"/>
  <word text="Ohta" break_level="SPACE_BREAK"/>
  <word text="&#39;&#39;" break_level="NO_BREAK"/>
  <word text="email" break_level="LINE_BREAK"/>
  <word text="=" break_level="NO_BREAK"/>
  <word text="``" break_level="NO_BREAK"/>
  <word text="mohta@necom830.cc.titech.ac.jp" break_level="NO_BREAK"/>
  <word text="&#39;&#39;" break_level="NO_BREAK"/>
  <word text="subject" lemma="subject" pos="NOUN" sense="/dictionary/sense/en_us_NOAD3e_2012/m_en_us1295267.001" break_level="LINE_BREAK"/>
  <word text="=" break_level="NO_BREAK"/>
  <word text="``" break_level="NO_BREAK"/>
  <word text="Re" break_level="NO_BREAK"/>
  <word text=":" break_level="NO_BREAK"/>
  <word text="CHARSET" break_level="SENTENCE_BREAK"/>
  <word text="considerations" lemma="consideration" pos="NOUN" sense="/dictionary/sense/en_us_NOAD3e_2012/m_en_us1235479.001" break_level="SPACE_BREAK"/>
  <word text="&#39;&#39;" break_level="NO_BREAK"/>
  <word text="id" break_level="LINE_BREAK"/>
  <word text="=" break_level="NO_BREAK"/>
  <word text="``" break_level="NO_BREAK"/>
  <word text="9305190317.AA01493" break_level="NO_BREAK"/>
  <word text="@" break_level="NO_BREAK"/>
  <word text="necom830.cc.titech.ac.jp" break_level="NO_BREAK"/>
  <word text="&#39;&#39;" break_level="NO_BREAK"/>
  <word text="inreplyto" break_level="LINE_BREAK"/>
  <word text="=" break_level="NO_BREAK"/>
  <word text="``" break_level="NO_BREAK"/>
  <word text="01GYBXHRZVEA8Y5JAE" break_level="NO_BREAK"/>
  <word text="@" break_level="NO_BREAK"/>
  <word text="INNOSOFT.COM" break_level="NO_BREAK"/>
  <word text="&#39;&#39;" break_level="NO_BREAK"/>
  <word text="To" break_level="PARAGRAPH_BREAK"/>
  <word text=":" break_level="NO_BREAK"/>
  <word text="TROTH@ricevm1.rice.edu" break_level="SENTENCE_BREAK"/>
  <word text="(" break_level="SPACE_BREAK"/>
  <word text="Rick" break_level="NO_BREAK"/>
  <word text="Troth" break_level="SPACE_BREAK"/>
  <word text=")" break_level="NO_BREAK"/>
  <word text="Cc" break_level="LINE_BREAK"/>
  <word text=":" break_level="NO_BREAK"/>
  <word text="scs@adam.mit.edu" break_level="SPACE_BREAK"/>
  <word text="," break_level="NO_BREAK"/>
  <word text="pine" break_level="SPACE_BREAK"/>
  <word text="-" break_level="NO_BREAK"/>
  <word text="info@cac.washington.edu" break_level="NO_BREAK"/>
  <word text="," break_level="NO_BREAK"/>
  <word text="ietf" break_level="SPACE_BREAK"/>
  <word text="-" break_level="NO_BREAK"/>
  <word text="charsets@INNOSOFT.COM" break_level="NO_BREAK"/>
  <word text="," break_level="NO_BREAK"/>
  <word text="I" break_level="PARAGRAPH_BREAK"/>
  <word text="do" lemma="do" pos="VERB" sense="/dictionary/sense/en_us_NOAD3e_2012/m_en_us1241237.035" break_level="SPACE_BREAK"/>
  <word text="n&#39;t" break_level="NO_BREAK"/>
  <word text="know" lemma="know" pos="VERB" sense="/dictionary/sense/en_us_NOAD3e_2012/m_en_us1261363.001" break_level="SPACE_BREAK"/>
  <word text="what" break_level="SPACE_BREAK"/>
  <word text="pine" break_level="SPACE_BREAK"/>
  <word text="is" lemma="be" pos="VERB" sense="/dictionary/sense/en_us_NOAD3e_2012/m_en_us1225404.008" break_level="SPACE_BREAK"/>
  <word text="." break_level="NO_BREAK"/>
  <word text="But" break_level="PARAGRAPH_BREAK"/>
  <word text="," break_level="NO_BREAK"/>
  <word text="could" lemma="could" pos="VERB" sense="/dictionary/sense/en_us_NOAD3e_2012/m_en_us1236433.001" break_level="SPACE_BREAK"/>
  <word text="you" break_level="SPACE_BREAK"/>
  <word text="please" break_level="SPACE_BREAK"/>
  <word text="discuss" break_level="SPACE_BREAK"/>
  <word text="on" break_level="SPACE_BREAK"/>
  <word text="pine" break_level="SPACE_BREAK"/>
  <word text="specific" lemma="specific" pos="ADJ" sense="/dictionary/sense/en_us_NOAD3e_2012/m_en_us1292910.001" break_level="SPACE_BREAK"/>
  <word text="features" lemma="feature" pos="NOUN" sense="/dictionary/sense/en_us_NOAD3e_2012/m_en_us1246503.001" break_level="SPACE_BREAK"/>
  <word text="in" break_level="SPACE_BREAK"/>
  <word text="pine" break_level="SPACE_BREAK"/>
  <word text="ML" break_level="SPACE_BREAK"/>
  <word text="only" lemma="only" pos="ADV" sense="/dictionary/sense/en_us_NOAD3e_2012/m_en_us1273443.001" break_level="LINE_BREAK"/>
  <word text="?" break_level="NO_BREAK"/>
  <word text="Masataka" break_level="PARAGRAPH_BREAK"/>
  <word text="Ohta" break_level="SPACE_BREAK"/>
</SimpleWsdDoc>
