<?xml version="1.0" encoding="UTF-8"?>
<!DOCTYPE SimpleWsdDoc SYSTEM "simple-wsd-doc.dtd">
<SimpleWsdDoc name="/written/email/219257.txt">
  <word text="/" break_level="NO_BREAK"/>
  <word text="written" break_level="NO_BREAK"/>
  <word text="/" break_level="NO_BREAK"/>
  <word text="email" break_level="NO_BREAK"/>
  <word text="/" break_level="NO_BREAK"/>
  <word text="219257.txt" break_level="NO_BREAK"/>
  <word text="Message" lemma="message" pos="NOUN" sense="/dictionary/sense/en_us_NOAD3e_2012/m_en_us1267368.001" break_level="PARAGRAPH_BREAK"/>
  <word text="-" break_level="NO_BREAK"/>
  <word text="ID" lemma="ID" pos="NOUN" sense="/dictionary/sense/en_us_NOAD3e_2012/m_en_us1256893.003" break_level="NO_BREAK"/>
  <word text=":" break_level="NO_BREAK"/>
  <word text="Date" lemma="date" pos="NOUN" sense="/dictionary/sense/en_us_NOAD3e_2012/m_en_us1238437.001" break_level="LINE_BREAK"/>
  <word text=":" break_level="NO_BREAK"/>
  <word text="Thu" break_level="SENTENCE_BREAK"/>
  <word text="," break_level="NO_BREAK"/>
  <word text="30" break_level="SPACE_BREAK"/>
  <word text="Aug" break_level="SPACE_BREAK"/>
  <word text="2001" break_level="SPACE_BREAK"/>
  <word text="13:32:27" break_level="SPACE_BREAK"/>
  <word text="-0700" break_level="SPACE_BREAK"/>
  <word text="(" break_level="SPACE_BREAK"/>
  <word text="PDT" break_level="NO_BREAK"/>
  <word text=")" break_level="NO_BREAK"/>
  <word text="From" break_level="LINE_BREAK"/>
  <word text=":" break_level="NO_BREAK"/>
  <word text="alan.comnes@enron.com" break_level="SPACE_BREAK"/>
  <word text="To" break_level="LINE_BREAK"/>
  <word text=":" break_level="NO_BREAK"/>
  <word text="e-mail" break_level="SPACE_BREAK"/>
  <word text="," break_level="SPACE_BREAK"/>
  <word text="ray.alvarez@enron.com" break_level="SPACE_BREAK"/>
  <word text="," break_level="NO_BREAK"/>
  <word text="robert.frank@enron.com" break_level="SPACE_BREAK"/>
  <word text="," break_level="NO_BREAK"/>
  <word text="tim.belden@enron.com" break_level="PARAGRAPH_BREAK"/>
  <word text="Subject" lemma="subject" pos="NOUN" sense="/dictionary/sense/en_us_NOAD3e_2012/m_en_us1295267.001" break_level="LINE_BREAK"/>
  <word text=":" break_level="NO_BREAK"/>
  <word text="Refund" break_level="SENTENCE_BREAK"/>
  <word text="Cases" break_level="SPACE_BREAK"/>
  <word text="Timelines" break_level="SPACE_BREAK"/>
  <word text="--" break_level="NO_BREAK"/>
  <word text="Confidential" break_level="SENTENCE_BREAK"/>
  <word text="Atty" break_level="SPACE_BREAK"/>
  <word text="Client" break_level="SPACE_BREAK"/>
  <word text="Work" break_level="SPACE_BREAK"/>
  <word text="Product" break_level="SPACE_BREAK"/>
  <word text="Cc" break_level="LINE_BREAK"/>
  <word text=":" break_level="NO_BREAK"/>
  <word text="d." break_level="SPACE_BREAK"/>
  <word text="." break_level="NO_BREAK"/>
  <word text="steffes@enron.com" break_level="SENTENCE_BREAK"/>
  <word text="Mime" break_level="LINE_BREAK"/>
  <word text="-" break_level="NO_BREAK"/>
  <word text="Version" lemma="version" pos="NOUN" sense="/dictionary/sense/en_us_NOAD3e_2012/m_en_us1303957.001" break_level="NO_BREAK"/>
  <word text=":" break_level="NO_BREAK"/>
  <word text="1.0" break_level="SPACE_BREAK"/>
  <word text="Content" lemma="content" pos="NOUN" sense="/dictionary/sense/en_us_NOAD3e_2012/m_en_us1235616.001" break_level="LINE_BREAK"/>
  <word text="-" break_level="NO_BREAK"/>
  <word text="Type" lemma="type" pos="NOUN" sense="/dictionary/sense/en_us_NOAD3e_2012/m_en_us1301323.001" break_level="NO_BREAK"/>
  <word text=":" break_level="NO_BREAK"/>
  <word text="text" lemma="text" pos="NOUN" sense="/dictionary/sense/en_us_NOAD3e_2012/m_en_us1298051.001" break_level="SPACE_BREAK"/>
  <word text="/" break_level="NO_BREAK"/>
  <word text="plain" break_level="NO_BREAK"/>
  <word text=";" break_level="NO_BREAK"/>
  <word text="charset" break_level="SPACE_BREAK"/>
  <word text="=" break_level="NO_BREAK"/>
  <word text="us" break_level="NO_BREAK"/>
  <word text="-" break_level="NO_BREAK"/>
  <word text="ascii" break_level="NO_BREAK"/>
  <word text="Content" lemma="content" pos="NOUN" sense="/dictionary/sense/en_us_NOAD3e_2012/m_en_us1235616.001" break_level="LINE_BREAK"/>
  <word text="-" break_level="NO_BREAK"/>
  <word text="Transfer" lemma="transfer" pos="NOUN" sense="/dictionary/sense/en_us_NOAD3e_2012/m_en_us1299918.010" break_level="NO_BREAK"/>
  <word text="-" break_level="NO_BREAK"/>
  <word text="Encoding" break_level="NO_BREAK"/>
  <word text=":" break_level="NO_BREAK"/>
  <word text="7bit" break_level="SPACE_BREAK"/>
  <word text="Bcc" break_level="LINE_BREAK"/>
  <word text=":" break_level="NO_BREAK"/>
  <word text="d." break_level="SPACE_BREAK"/>
  <word text="." break_level="NO_BREAK"/>
  <word text="steffes@enron.com" break_level="SENTENCE_BREAK"/>
  <word text="Tim" break_level="PARAGRAPH_BREAK"/>
  <word text="," break_level="NO_BREAK"/>
  <word text="Per" break_level="PARAGRAPH_BREAK"/>
  <word text="your" break_level="SPACE_BREAK"/>
  <word text="request" break_level="SPACE_BREAK"/>
  <word text="." break_level="NO_BREAK"/>
  <word text="Everybody" break_level="PARAGRAPH_BREAK"/>
  <word text="else" break_level="SPACE_BREAK"/>
  <word text=":" break_level="NO_BREAK"/>
  <word text="please" break_level="SPACE_BREAK"/>
  <word text="forward" lemma="forward" pos="VERB" sense="/dictionary/sense/en_us_NOAD3e_2012/m_en_us1248624.022" break_level="SPACE_BREAK"/>
  <word text="corrections" break_level="SPACE_BREAK"/>
  <word text="/" break_level="NO_BREAK"/>
  <word text="updates" break_level="NO_BREAK"/>
  <word text="to" break_level="SPACE_BREAK"/>
  <word text="me" break_level="SPACE_BREAK"/>
  <word text="." break_level="NO_BREAK"/>
  <word text="Thanks" break_level="PARAGRAPH_BREAK"/>
  <word text="," break_level="NO_BREAK"/>
  <word text="Alan" break_level="PARAGRAPH_BREAK"/>
  <word text="Comnes" break_level="SPACE_BREAK"/>
</SimpleWsdDoc>
