<?xml version="1.0" encoding="UTF-8"?>
<!DOCTYPE SimpleWsdDoc SYSTEM "simple-wsd-doc.dtd">
<SimpleWsdDoc name="/written/spam/ucb21.txt">
  <word text="/" break_level="NO_BREAK"/>
  <word text="written" break_level="NO_BREAK"/>
  <word text="/" break_level="NO_BREAK"/>
  <word text="spam" lemma="spam" pos="NOUN" sense="/dictionary/sense/en_us_NOAD3e_2012/m_en_us1292742.002" break_level="NO_BREAK"/>
  <word text="/" break_level="NO_BREAK"/>
  <word text="ucb21.txt" break_level="NO_BREAK"/>
  <word text="From" break_level="PARAGRAPH_BREAK"/>
  <word text=":" break_level="NO_BREAK"/>
  <word text="``" break_level="SPACE_BREAK"/>
  <word text="chet" break_level="NO_BREAK"/>
  <word text="heidi" break_level="SPACE_BREAK"/>
  <word text="&#39;&#39;" break_level="NO_BREAK"/>
  <word text="To" break_level="LINE_BREAK"/>
  <word text=":" break_level="NO_BREAK"/>
  <word text="Subject" lemma="subject" pos="NOUN" sense="/dictionary/sense/en_us_NOAD3e_2012/m_en_us1295267.001" break_level="LINE_BREAK"/>
  <word text=":" break_level="NO_BREAK"/>
  <word text="spring" lemma="spring" pos="NOUN" sense="/dictionary/sense/en_us_NOAD3e_2012/m_en_us1293466.015" break_level="SPACE_BREAK"/>
  <word text="selection" lemma="selection" pos="NOUN" sense="/dictionary/sense/en_us_NOAD3e_2012/m_en_us1288633.001" break_level="SPACE_BREAK"/>
  <word text="Date" lemma="date" pos="NOUN" sense="/dictionary/sense/en_us_NOAD3e_2012/m_en_us1238437.001" break_level="LINE_BREAK"/>
  <word text=":" break_level="NO_BREAK"/>
  <word text="Wed" break_level="SENTENCE_BREAK"/>
  <word text="," break_level="NO_BREAK"/>
  <word text="17" break_level="SPACE_BREAK"/>
  <word text="Mar" break_level="SPACE_BREAK"/>
  <word text="2010" break_level="SPACE_BREAK"/>
  <word text="05:29:10" break_level="SPACE_BREAK"/>
  <word text="+0000" break_level="SPACE_BREAK"/>
  <word text="Detailed" lemma="detailed" pos="ADJ" sense="/dictionary/sense/en_us_NOAD3e_2012/m_en_us1239807.001" break_level="PARAGRAPH_BREAK"/>
  <word text="quality" break_level="SPACE_BREAK"/>
  <word text="replicas" break_level="SPACE_BREAK"/>
  <word text="of" break_level="SPACE_BREAK"/>
  <word text="the" break_level="SPACE_BREAK"/>
  <word text="most" lemma="most" pos="ADV" sense="/dictionary/sense/en_us_NOAD3e_2012/m_en_us1269360.005" break_level="SPACE_BREAK"/>
  <word text="wanted" break_level="SPACE_BREAK"/>
  <word text="designer" break_level="SPACE_BREAK"/>
  <word text="watches" lemma="watch" pos="NOUN" sense="/dictionary/sense/en_us_NOAD3e_2012/m_en_us1305222.010" break_level="SPACE_BREAK"/>
  <word text="are" break_level="SPACE_BREAK"/>
  <word text="here" lemma="here" pos="ADV" sense="/dictionary/sense/en_us_NOAD3e_2012/m_en_us1254554.001" break_level="SPACE_BREAK"/>
  <word text="!" break_level="NO_BREAK"/>
  <word text="genuine" break_level="LINE_BREAK"/>
  <word text="solid" lemma="solid" pos="ADJ" sense="/dictionary/sense/en_us_NOAD3e_2012/m_en_us1292245.001" break_level="SPACE_BREAK"/>
  <word text="stainless" break_level="SPACE_BREAK"/>
  <word text="steel" break_level="SPACE_BREAK"/>
  <word text="," break_level="NO_BREAK"/>
  <word text="and" break_level="SPACE_BREAK"/>
  <word text="99.9" break_level="SPACE_BREAK"/>
  <word text="%" break_level="NO_BREAK"/>
  <word text="accurate" lemma="accurate" pos="ADJ" sense="/dictionary/sense/en_us_NOAD3e_2012/m_en_us1219600.001" break_level="SPACE_BREAK"/>
  <word text="markings" break_level="SPACE_BREAK"/>
  <word text="," break_level="NO_BREAK"/>
  <word text="finish" lemma="finish" pos="NOUN" sense="/dictionary/sense/en_us_NOAD3e_2012/m_en_us1247159.011" break_level="SPACE_BREAK"/>
  <word text="and" break_level="SPACE_BREAK"/>
  <word text="=" break_level="SPACE_BREAK"/>
  <word text="weight" lemma="weight" pos="NOUN" sense="/dictionary/sense/en_us_NOAD3e_2012/m_en_us1305598.001" break_level="LINE_BREAK"/>
  <word text="." break_level="NO_BREAK"/>
  <word text="-" break_level="SENTENCE_BREAK"/>
  <word text="The" break_level="SPACE_BREAK"/>
  <word text="worlds" lemma="world" pos="NOUN" sense="/dictionary/sense/en_us_NOAD3e_2012/m_en_us1307108.001" break_level="SPACE_BREAK"/>
  <word text="largest" lemma="large" pos="ADJ" sense="/dictionary/sense/en_us_NOAD3e_2012/m_en_us1262244.001" break_level="SPACE_BREAK"/>
  <word text="online" break_level="SPACE_BREAK"/>
  <word text="retailer" break_level="SPACE_BREAK"/>
  <word text="of" break_level="SPACE_BREAK"/>
  <word text="luxury" break_level="SPACE_BREAK"/>
  <word text="products" lemma="product" pos="NOUN" sense="/dictionary/sense/en_us_NOAD3e_2012/m_en_us1280957.001" break_level="SPACE_BREAK"/>
  <word text="," break_level="NO_BREAK"/>
  <word text="including" lemma="include" pos="VERB" sense="/dictionary/sense/en_us_NOAD3e_2012/m_en_us1257529.001" break_level="SPACE_BREAK"/>
  <word text=":" break_level="NO_BREAK"/>
  <word text="Rolex" break_level="SENTENCE_BREAK"/>
  <word text="Sports" break_level="SPACE_BREAK"/>
  <word text="Models" lemma="model" pos="NOUN" sense="/dictionary/sense/en_us_NOAD3e_2012/m_en_us1268618.009" break_level="SPACE_BREAK"/>
  <word text="Rolex" break_level="LINE_BREAK"/>
  <word text="Datejusts" break_level="SPACE_BREAK"/>
  <word text="Breitling" break_level="LINE_BREAK"/>
  <word text="Cartier" break_level="LINE_BREAK"/>
  <word text="Porsche" break_level="LINE_BREAK"/>
  <word text="Design" break_level="SPACE_BREAK"/>
  <word text="Dolce" break_level="LINE_BREAK"/>
  <word text="&amp;" break_level="SPACE_BREAK"/>
  <word text="Gabbana" break_level="SPACE_BREAK"/>
  <word text="Dior" break_level="LINE_BREAK"/>
  <word text="Gucci" break_level="LINE_BREAK"/>
  <word text="Hermes" break_level="LINE_BREAK"/>
  <word text="Watches" break_level="SPACE_BREAK"/>
  <word text="Patek" break_level="LINE_BREAK"/>
  <word text="Philippe" break_level="SPACE_BREAK"/>
  <word text="Visit" break_level="LINE_BREAK"/>
  <word text="-" break_level="SPACE_BREAK"/>
  <word text="www.devasiess.com" break_level="SPACE_BREAK"/>
</SimpleWsdDoc>
